word,part_of_speech,definition,example,synonyms
rebuke,"n, v",censure severely or angrily; an act or expression of criticism and censure,The mother scolded the child for entering a stranger's car; The deputy ragged the Prime Minister; he had to take the rebuke with a smile on his face; The customer dressed down the waiter for bringing cold soup,"bawl out, berate, call down, call on the carpet, chew out, chew up, chide, dress down, have words, jaw, lambast, lambaste, lecture, rag, remonstrate, reprehension, reprimand, reproof, reproval, scold, take to task, trounce"
recalcitrant,s,marked by stubborn resistance to authority; stubbornly resistant to authority or control,a fractious animal that would not submit to the harness; a refractory child; the University suspended the most recalcitrant demonstrators,"fractious, refractory"
recant,v,"formally reject or disavow a formerly held belief, usually under pressure",She abjured her beliefs; He retracted his earlier statements about his religion,"abjure, forswear, resile, retract"
recondite,s,difficult to penetrate; incomprehensible to one of ordinary understanding or knowledge,the professor's lectures were so abstruse that students tended to avoid them; some recondite problem in historiography; a deep metaphysical theory,"abstruse, deep"
reconnoiter,v,"explore, often with the goal of finding something or somebody",,"reconnoitre, scout"
recreant,"n, s",having deserted a cause or principle; lacking even the rudiments of courage; abjectly fearful; ; ; - Spenser; an abject coward; a disloyal person who betrays or deserts his cause or religion or political party or friend etc.,this recreant knight; the craven fellow turned and ran; a craven proposal to raise the white flag; some provinces had proved recreant; renegade supporters of the usurper,"apostate, craven, deserter, poltroon, ratter, renegade, turncoat"
recrimination,n,mutual accusations,,
recrudesce,v,happen; become raw or open,These political movements recrudesce from time to time; My skin breaks out when I eat strawberries; He broke out in hives; Report the news as it develops; Such boils tend to recrudesce,"break, break out, develop, erupt"
rectitude,n,righteousness as a consequence of being honorable and honest,,uprightness
recumbent,s,lying down; in a position of comfort or rest,,"accumbent, decumbent"
redolent,s,(used with `of' or `with') noticeably odorous; having a strong pleasant odor; - Jean Stafford; serving to bring to mind; - Wilder Hobson,air redolent with the fumes of beer and whiskey; cannot forbear to close on this redolent literary note; the hall was redolent of floor wax; a campaign redolent of machine politics; the pine woods were more redolent,"aromatic, evocative, remindful, reminiscent, resonant, smelling"
redouble,v,"double in magnitude, extent, or intensity; make twice as great or intense; double again",The noise doubled and redoubled; The enemy redoubled their screaming on the radio; The screaming redoubled,
redoubled,"s, v","become much greater in intensity or size or amount; double in magnitude, extent, or intensity; make twice as great or intense; double again",we faced redoubled attacks from the enemy; The noise doubled and redoubled; The enemy redoubled their screaming on the radio; despite our redoubled efforts; The screaming redoubled,redouble
redoubtable,s,inspiring fear; ; - G.H.Johnston; worthy of respect or honor,"a tougher and more redoubtable adversary than the heel-clicking, jackbooted fanatic; something unnerving and prisonlike about high grey wall; the formidable prospect of major surgery; born of a redoubtable family","formidable, unnerving"
redress,"n, v",make reparations or amends for; act of correcting an error or a fault or an evil; a sum of money paid in compensation for loss or injury,right a wrongs done to the victims of the Holocaust,"amends, compensate, correct, damages, indemnification, indemnity, remediation, remedy, restitution, right"
refractory,"n, s",stubbornly resistant to authority or control; lining consisting of material with a high melting point; used to line the inside walls of a furnace; temporarily unresponsive or not fully responsive to nervous or sexual stimuli; not responding to treatment,a fractious animal that would not submit to the harness; a refractory case of acne; a refractory child; a stubborn infection; the refractory period of a muscle fiber; stubborn rust stains,"fractious, furnace lining, recalcitrant, stubborn"
refulgent,s,radiating or as if radiating light,a refulgent sunset; a radiant sunrise; the effulgent daffodils; the beaming sun,"beaming, beamy, effulgent, radiant"
rejoinder,n,(law) a pleading made by a defendant in response to the plaintiff's replication; a quick reply to a question or remark (especially a witty or critical one),it brought a sharp rejoinder from the teacher,"comeback, counter, replication, retort, return, riposte"
relegate,v,"expel, as if by official decree; assign to a lower position; reduce in rank; assign to a class or kind; refer to another person for decision or judgment",She likes to relegate difficult questions to her colleagues; He was broken down to Sergeant; How should algae be classified?; he was banished from his own country; People argue about how to relegate certain mushrooms; She was demoted because she always speaks up,"banish, bar, break, bump, classify, demote, kick downstairs, pass on, submit"
remonstrate,v,censure severely or angrily; argue in protest or opposition; present and urge reasons in opposition,The mother scolded the child for entering a stranger's car; The deputy ragged the Prime Minister; The customer dressed down the waiter for bringing cold soup,"bawl out, berate, call down, call on the carpet, chew out, chew up, chide, dress down, have words, jaw, lambast, lambaste, lecture, point out, rag, rebuke, reprimand, reproof, scold, take to task, trounce"
remuneration,n,something that remunerates; the act of paying for goods or services or to recompense for losses,wages were paid by check; they saved a quarter of all their earnings; adequate remuneration for his work; he wasted his pay on drink,"earnings, pay, salary, wage"
repast,n,the food served and eaten at one time,,meal
repine,v,express discontent,,
reprisal,n,a retaliatory action against an enemy in wartime,,
reproach,"n, v",express criticism towards; a mild rebuke or criticism; disgrace or shame,words of reproach; he brought reproach upon his family; The president reproached the general for his irresponsible behavior,upbraid
reprobate,"n, s, v",deviating from what is considered moral or right or proper or good; reject (documents) as invalid; express strong disapproval of; a person without moral scruples; abandon to eternal damnation,a perverted sense of loyalty; the reprobate conduct of a gambling aristocrat; depraved criminals; We condemn the racism in South Africa; These ideas were reprobated; God reprobated the unrepenting sinner,"condemn, decry, depraved, excoriate, miscreant, objurgate, perverse, perverted"
repudiate,v,"refuse to recognize or pay; cast off; refuse to acknowledge, ratify, or recognize as valid; reject as untrue, unfounded, or unjust",The parents repudiated their son; repudiate a debt; The woman repudiated the divorce settlement; She renounced her husband; She repudiated the accusations,"disown, renounce"
repugnant,s,offensive to the mind,the most repulsive character in recent novels; repulsive behavior; the obscene massacre at Wounded Knee; an abhorrent deed; morally repugnant customs,"abhorrent, detestable, obscene, repulsive"
requite,v,make repayment for or return something,,repay
resolve,"n, v",a formal expression by a meeting; agreed to by a vote; understand the meaning of; make clearly visible; cause to go into a solution; reach a conclusion after a discussion or deliberation; find the solution; reach a decision; bring to an end; settle conclusively; the trait of being resolute,it was his unshakeable resolution to finish the work; can this image be resolved?; The case was decided; solve an equation; he resolved never to drink again; solve for x; The judge decided the case in favor of the plaintiff; The question concerning the meaning of life cannot be answered; his resoluteness carried him through the battle; The recipe says that we should dissolve a cup of sugar in two cups of water; The father adjudicated when the sons were quarreling over their inheritance,"adjudicate, answer, break up, conclude, decide, declaration, dissolve, firmness, firmness of purpose, purpose, resoluteness, resolution, settle, solve"
respite,"n, v","a (temporary) relief from harm or discomfort; an interruption in the intensity or amount of something; a pause from doing something (as work); postpone the punishment of a convicted criminal, such as an execution; a pause for relaxation; the act of reprieving; postponing or remitting punishment",we took a 10-minute break; he took time out to recuperate; people actually accomplish more when they take time for short rests,"abatement, break, hiatus, recess, relief, reprieve, rest, rest period, suspension, time out"
restive,s,being in a tense state; impatient especially under restriction or delay,the government has done nothing to ease restrictions and manufacturers are growing restive,"edgy, high-strung, highly strung, jittery, jumpy, nervy, overstrung, uptight"
retrenchment,n,the reduction of expenditures in order to become financially stable; entrenchment consisting of an additional interior fortification to prolong the defense,,"curtailment, downsizing"
retribution,n,a justly deserved penalty; the act of taking revenge (harming someone in retaliation for something harmful that they have done) especially in the next life; --Romans 12:19; --James Garfield; the act of correcting for your wrongdoing,"he swore vengeance on the man who betrayed him; Vengeance is mine; I will repay, saith the Lord; For vengeance I would do nothing. This nation is too great to look for mere revenge; the swiftness of divine retribution","payback, requital, vengeance"
revelatory,s,prophetic of devastation or ultimate doom; (usually followed by `of') pointing out or revealing clearly,actions indicative of fear,"apocalyptic, apocalyptical, indicative, indicatory, significative, suggestive"
rhapsodize,v,recite a rhapsody; say (something) with great enthusiasm,,rhapsodise
ribald,"n, s",humorously vulgar; a ribald person; someone who uses vulgar and offensive language,bawdy songs; off-color jokes; ribald language,"bawdy, off-color"
riposte,"n, v",(fencing) a counterattack made immediately after successfully parrying the opponents lunge; answer back; a quick reply to a question or remark (especially a witty or critical one); make a return thrust,his opponent riposted; it brought a sharp rejoinder from the teacher,"come back, comeback, counter, rejoin, rejoinder, repay, replication, retort, return"
robin,n,small Old World songbird with a reddish breast; large American thrush having a rust-red breast and abdomen,,"American robin, Erithacus rubecola, Old World robin, Turdus migratorius, redbreast, robin redbreast"
round,"s, v, n, r, a","wind around; move along a circular course; attack in speech or writing; pronounce with rounded lips; a crosspiece between the legs of a chair; make round; a partsong in which voices follow each other; one voice starts and others join in one after another until all are singing different parts of the song at the same time; any circular or rotating mechanism; become round, plump, or shapely; express as a round number; from beginning to end; throughout; (of sounds) full and rich; (mathematics) expressed to the nearest integer, ten, hundred, or thousand; a charge of ammunition for a single shot; a regular route for a sentry or policeman; the usual activities in your day; a cut of beef between the rump and the lower leg; the course along which communications spread; the activity of playing 18 holes of golf; bring to a highly developed, finished, or refined state; an outburst of applause; (often plural) a series of professional calls (usually in a set order); (sports) a division during which one team is on the offensive; a serving to each of a group (usually alcoholic); an interval during which a recurring sequence of events occurs; having a circular shape",frigid weather the year around; there was a round of applause; round the bend; polish your social manners; the postman's rounds; round off the amount; orotund tones; in the old days a policeman walked a beat and knew all his people by name; the never-ending cycle of the seasons; he ordered a second round; The editors of the left-leaning paper attacked the new House Speaker; a round of golf takes about 4 hours; the doctor goes on his rounds first thing every morning; in round numbers; the story is going the rounds in Washington; the doctor made his rounds; they enjoyed singing rounds; pear-shaped vowels; The young woman is fleshing out; the machine punched out metal circles; round the edges; the rotund and reverberating phrase; we enjoyed our round of the local bars; It rains all year round on Skye,"around, assail, assault, attack, beat, bout, brush up, circle, circular, cycle, daily round, fill out, flesh out, labialise, labialize, lash out, one shot, orotund, pear-shaped, polish, polish up, rhythm, rotund, round down, round of drinks, round of golf, round off, round out, rung, snipe, stave, troll, turn, unit of ammunition"
row,"n, v","an arrangement of objects or people side by side in a line; propel with oars; a linear array of numbers, letters, or symbols side by side; (construction) a layer of masonry; a continuous chronological succession without an interruption; the act of rowing as a sport; an angry dispute; a long continuous strip (usually running horizontally)",rows of barbed wire protected the trenches; row the boat across the lake; they had a quarrel; they had words; a course of bricks; a row of chairs; a mackerel sky filled with rows of clouds; they won the championship three years in a row,"course, dustup, quarrel, rowing, run-in, words, wrangle"
salacious,s,characterized by lust; suggestive of or tending to moral looseness,prurient thoughts; prurient literature; obscene telephone calls; her sensuous grace roused his lustful nature; salacious limericks; lewd whisperings of a dirty old man; eluding the lubricious embraces of her employer; a salacious rooster of a little man; an indecent gesture,"lewd, lubricious, lustful, obscene, prurient, raunchy"
salutary,s,tending to promote physical well-being; beneficial to health,beneficial effects of a balanced diet; a good night's sleep; the salutary influence of pure air,good
salvo,n,an outburst resembling the discharge of firearms or the release of bombs; a sudden outburst of cheers; rapid simultaneous discharge of firearms,there was a salvo of approval; our fusillade from the left flank caught them by surprise,"burst, fusillade, volley"
sangfroid,,,,
sanguinary,s,marked by eagerness to resort to violence and bloodshed; ; ; -G.W.Johnson; accompanied by bloodshed,went after the collaborators with a sanguinary fury that drenched the land with blood; bloody-minded tyrants; bloodthirsty yells; this bitter and sanguinary war,"bloodthirsty, bloody-minded, butcherly, gory, sanguineous, slaughterous"
sate,v,fill to satisfaction,I am sated,"fill, replete, satiate"
scintillating,"s, v",physics: fluoresce momentarily when struck by a charged particle or high-energy photon; brilliantly clever; marked by high spirits or excitement; give off; reflect brightly; having brief brilliant points or flashes of light; emit or reflect light in a flickering manner; be lively or brilliant or exhibit virtuosity,Does a constellation twinkle more brightly than a single star?; the phosphor fluoresced; a row of sparkly cheerleaders; his fertile effervescent mind; shop window full of glittering Christmas trees; scintillating personality; his playing coruscated throughout the concert hall; the scintillating stars; A scintillating conversation; bugle beads all aglitter; scintillating wit; Unquarried marble sparkled on the hillside; a play full of scintillating dialogue; glinting water; `glistering' is an archaic term; glinting eyes; the substance scintillated sparks and flashes; a dress with sparkly sequins; glittery costume jewelry; The musical performance sparkled; scintillant mica; his glittering eyes were cold and malevolent,"aglitter, bubbling, coruscant, coruscate, effervescent, frothy, fulgid, glinting, glistering, glittering, glittery, scintillant, scintillate, sparkle, sparkly, twinkle, winkle"
sclerotic,a,of or relating to the sclera of the eyeball; relating to or having sclerosis; hardened,a sclerotic patient; sclerotic tissue,sclerosed
scofflaw,n,one who habitually ignores the law and does not answer court summonses,,
screed,n,an accurately levelled strip of material placed on a wall or floor as guide for the even application of plaster or concrete; a long monotonous harangue; a long piece of writing,,
scruple,"n, v",an ethical or moral principle that inhibits action; have doubts about; a unit of apothecary weight equal to 20 grains; hesitate on moral grounds; raise scruples; uneasiness about the fitness of an action,He lied and did not even scruple about it; The man scrupled to perjure himself,"misgiving, qualm"
scrupulous,"s, a",having scruples; arising from a sense of right and wrong; principled; characterized by extreme care and great effort,less scrupulous producers sent bundles that were deceptive in appearance; painstaking research; conscientious application to the work at hand; scrupulous attention to details,"conscientious, painstaking"
sedition,n,an illegal action inciting resistance to lawful authority and tending to cause the disruption or overthrow of the government,,
sedulous,s,marked by care and persistent effort,assiduous research; sedulous pursuit of legal and moral principles; her assiduous attempts to learn French,assiduous
self styled,,,,
self-styled,s,as claimed by and for yourself often without justification,the self-styled `doctor' has no degree of any kind,soi-disant
sententious,s,concise and full of meaning; ; - Hervey Allen; abounding in or given to pompous or aphoristic moralizing; - Kathleen Barnes,too often the significant episode deteriorates into sententious conversation; the peculiarly sardonic and sententious style in which Don Luis composed his epigrams; welcomed her pithy comments,pithy
sephulcral,,,,
shoehorn,"n, v",a device used for easing the foot into a shoe; fit for a specific purpose even when not well suited,,
sidle,v,move unobtrusively or furtively; move sideways,The young man began to sidle near the pretty girl sitting on the log,sashay
simulacrum,n,a representation of a person (especially in the form of sculpture); an insubstantial or vague semblance,the emperor's tomb had his image carved in stone; the coin bears an effigy of Lincoln,"effigy, image"
sinecure,n,a benefice to which no spiritual or pastoral duties are attached; an office that involves minimal duties,,
sinewy,"s, a",(of a person) possessing physical strength and weight; rugged and powerful; consisting of tendons or resembling a tendon; (of meat) full of sinews; especially impossible to chew,powerful arms; a hefty athlete; a muscular boxer,"brawny, fibrous, hefty, muscular, powerful, stringy, tendinous, unchewable"
sinuous,s,curved or curving in and out,wiggly lines,"sinuate, wiggly"
skein,n,coils of worsted yarn,,
skullduggery,n,verbal misrepresentation intended to take advantage of you in some way,,"hanky panky, hocus-pocus, jiggery-pokery, skulduggery, slickness, trickery"
slake,v,satisfy (thirst); make less active or intense; cause to heat and crumble by treatment with water,The cold water quenched his thirst; slack lime,"abate, allay, assuage, quench, slack"
slatternly,s,characteristic of or befitting a slut or slattern; used especially of women,,"blowsy, blowzy, sluttish"
slovenly,s,negligent of neatness especially in dress and person; habitually dirty and unkempt,filled the door with her frowzy bulk; frowzy white hair; slovenly appearance,"frowsy, frowzy"
smattering,"n, v",to talk foolishly; a slight or superficial understanding of a subject; speak with spotty or superficial knowledge; a small number or amount; work with in an amateurish manner,She dabbles in astronomy; She smatters Russian; He plays around with investments but he never makes any money; only a handful of responses were received; The two women babbled and crooned at the baby,"babble, blather, blether, blither, dabble, handful, play around, smatter"
snub,"n, s, v",reject outright and bluntly; a refusal to recognize someone you know; refuse to acknowledge; unusually short; an instance of driving away or warding off,a snub nose; the snub was clearly intentional; She cut him dead at the meeting; She snubbed his proposal,"cold shoulder, cut, disregard, ignore, rebuff, repel, repulse"
solecism,n,a socially awkward or tactless act,,"faux pas, gaffe, gaucherie, slip"
solicitous,s,showing hovering attentiveness; full of anxiety and concern,solicitous about her health; solicitous parents; solicitous about the future; made solicitous inquiries about our family,
solicitude,n,a feeling of excessive concern,,solicitousness
somnolent,s,inclined to or marked by drowsiness,slumberous (or slumbrous) eyes; the sound had a somnolent effect; `slumbery' is archaic,"slumberous, slumbery, slumbrous"
sophist,n,someone whose reasoning is subtle and often specious; any of a group of Greek philosophers and teachers in the 5th century BC who speculated on a wide range of subjects,,casuist
sordid,s,foul and run-down and repulsive; unethical or dishonest; meanly avaricious and mercenary; morally degraded; ; ; ; - Seattle Weekly; - James Joyce,the seamy side of life; a flyblown bar on the edge of town; sordid shantytowns; sordid material interests; the sordid details of his orgies stank under his very nostrils; squalid living conditions; sleazy characters hanging around casinos; a seedy district; dirty police officers; sordid avarice; the squalid atmosphere of intrigue and betrayal; sleazy storefronts with...dirt on the walls; a squalid overcrowded apartment in the poorest part of town; a sordid political campaign,"dirty, flyblown, seamy, seedy, sleazy, squalid"
spasmodic,s,affected by involuntary jerky muscular contractions; resembling a spasm; occurring in spells and often abruptly,fitful bursts of energy; spasmodic rifle fire; his body made a spasmodic jerk; convulsive motions; spastic movements,"convulsive, fitful, spastic"
spate,n,a sudden forceful flow; (often followed by `of') a large number or amount or extent; the occurrence of a water flow resulting from sudden rain or melting snow,a slew of journalists; see the rest of the winners in our huge passel of photos; a deal of trouble; he made a mint on the stock market; a lot of money; it must have cost plenty; a batch of letters; a wad of money,"batch, deal, flock, freshet, good deal, great deal, hatful, heap, lot, mass, mess, mickle, mint, mountain, muckle, passel, peck, pile, plenty, pot, quite a little, raft, rush, sight, slew, stack, surge, tidy sum, upsurge, wad"
specious,s,based on pretense; deceptively pleasing; plausible but false,a meretricious argument; spurious inferences; a specious claim; meretricious praise; the gilded and perfumed but inwardly rotten nobility,"gilded, meretricious, spurious"
spendthrift,"n, s",someone who spends money prodigally; recklessly wasteful,prodigal in their expenditures,"extravagant, prodigal, profligate, scattergood, spend-all, spender"
splenetic,"s, a",of or relating to the spleen; very irritable,he became prickly and spiteful; witty and waspish about his colleagues; bristly exchanges between the White House and the press,"bristly, lienal, prickly, splenic, waspish"
sportive,"s, a",given to merry frolicking; relating to or interested in sports,frolicsome students celebrated their graduation with parties and practical jokes,"coltish, frolicky, frolicsome, rollicking"
spurn,v,reject with contempt,She spurned his advances,"disdain, freeze off, pooh-pooh, reject, scorn, turn down"
squelch,"n, v","walk through mud or mire; a crushing remark; to compress with violence, out of natural shape or condition; an electric circuit that cuts off a receiver when the signal becomes weaker than the noise; make a sucking sound; suppress or crush completely",squelch any sign of dissent; squeeze a lemon; quench a rebellion; We had to splosh across the wet meadow; crush an aluminum can,"crush, mash, put-down, quell, quench, slop, slosh, splash, splosh, squash, squeeze, squelch circuit, squelcher, squish, takedown"
staid,s,characterized by dignity and propriety,,sedate
stalwart,"n, s",used especially of persons; a person who is loyal to their allegiance (especially in times of revolt); having rugged physical strength; inured to fatigue or hardships; dependable,sturdy young athletes; a stouthearted fellow who had an active career in the army; proud of her tall stalwart son; a stalwart knight; stout hearts; the stalwart citizens at Lexington; a stalwart supporter of the UN; stout seamen; hardy explorers of northern Canada,"hardy, loyalist, stout, stouthearted, sturdy"
